{
  "schemaVersion": "molit.identity-runtime-config/1",
  "mode": "rfc7662-introspection",
  "network": {
    "allowedOrigins": ["https://identity.data.molit.go.kr"],
    "allowInsecureLoopback": false,
    "timeoutMs": 5000,
    "maxResponseBytes": 1048576
  },
  "policy": {
    "issuer": "https://identity.data.molit.go.kr/",
    "audiences": ["molit-dsaas"],
    "clientIdClaim": "client_id",
    "tokenIdClaim": "jti",
    "actorTypeClaim": "actor_type",
    "rolesClaim": "roles",
    "tenantIdsClaim": "dataspace_ids",
    "actorTypes": { "human": "human", "service": "service" },
    "allowedClientIds": ["molit-dsaas-console", "molit-dsaas-automation"],
    "allowedRoles": ["dsaas.operator", "dsaas.dataspace-admin", "dsaas.dataspace-reader"],
    "clockSkewSeconds": 30,
    "maxTokenLifetimeSeconds": 900,
    "humanMfa": {
      "acceptedAcrValues": ["urn:molit:loa:mfa"],
      "requiredAmrAny": ["otp", "hwk", "webauthn"]
    }
  },
  "introspection": {
    "introspectionUrl": "https://identity.data.molit.go.kr/oauth2/introspect",
    "clientId": "molit-dsaas-resource-server",
    "clientSecretRef": "file:///var/run/secrets/molit-identity/introspection-client-secret",
    "readinessMaxAgeMs": 60000
  }
}
